{"schema":"oregon.mutation-evidence.manifest/v1","manifest_version":1,"public_claim_boundary":"Selected semantic production mutations only; mutation testing is not formal proof, exhaustive fault coverage, or proof of absence of bugs.","authorities":[{"id":"EA","display_name":"Execution Address","runner":"scripts/verify_execution_address_mutations.py","runner_sha256":"2f0fcdf7ea01cde07e339753fc214b08903a1b028887ad4afbd25f2623f8a3e4","command":["python3","scripts/verify_execution_address_mutations.py"],"expected_count":3,"mutations":[{"id":"EA-001","name":"unknown-kind acceptance","target":"crates/oregon-primitives/src/execution_address.rs","expected_broken_behavior":"Injected broken behavior: unknown-kind acceptance.","killing_test":"unknown_kinds_are_rejected_instead_of_becoming_another_namespace","kill_classification":"semantic-test-failure"},{"id":"EA-002","name":"noncanonical EVM padding acceptance","target":"crates/oregon-primitives/src/execution_address.rs","expected_broken_behavior":"Injected broken behavior: noncanonical EVM padding acceptance.","killing_test":"nonzero_evm_padding_cannot_create_aliases","kill_classification":"semantic-test-failure"},{"id":"EA-003","name":"coordinated WASM/Oregon namespace reassignment","target":"crates/oregon-primitives/src/execution_address.rs","expected_broken_behavior":"Injected broken behavior: coordinated WASM/Oregon namespace reassignment.","killing_test":"semantic_namespaces_use_their_frozen_wire_tags","kill_classification":"semantic-test-failure"}]},{"id":"EE","display_name":"Execution Envelope","runner":"scripts/verify_execution_envelope_mutations.py","runner_sha256":"7a33b49275ce33631ca8f2c66e72149d80b8a21530c0fad5e5fc8d7419d073e8","command":["python3","scripts/verify_execution_envelope_mutations.py"],"expected_count":9,"mutations":[{"id":"EE-001","name":"unknown domain accepted as EVM","target":"crates/oregon-primitives/src/execution_envelope.rs","expected_broken_behavior":"Injected broken behavior: unknown domain accepted as EVM.","killing_test":"discriminants_are_frozen_and_unknown_values_fail_closed","kill_classification":"semantic-test-failure"},{"id":"EE-002","name":"identical explicit fee payer accepted","target":"crates/oregon-primitives/src/execution_envelope.rs","expected_broken_behavior":"Injected broken behavior: identical explicit fee payer accepted.","killing_test":"fee_payer_presence_and_scope_rules_are_canonical","kill_classification":"semantic-test-failure"},{"id":"EE-003","name":"oversized envelope bypasses top-level bound","target":"crates/oregon-primitives/src/execution_envelope.rs","expected_broken_behavior":"Injected broken behavior: oversized envelope bypasses top-level bound.","killing_test":"decoder_rejects_noncanonical_option_flags_and_total_size_first","kill_classification":"semantic-test-failure"},{"id":"EE-004","name":"distinct fee payer allowed without fee-payer authorization","target":"crates/oregon-primitives/src/execution_envelope.rs","expected_broken_behavior":"Injected broken behavior: distinct fee payer allowed without fee-payer authorization.","killing_test":"fee_payer_presence_and_scope_rules_are_canonical","kill_classification":"semantic-test-failure"},{"id":"EE-005","name":"execution domain omitted from native signing commitment","target":"crates/oregon-primitives/src/execution_envelope.rs","expected_broken_behavior":"Injected broken behavior: execution domain omitted from native signing commitment.","killing_test":"chain_and_domain_are_bound_into_native_signing_commitment","kill_classification":"semantic-test-failure"},{"id":"EE-006","name":"authorization scope omitted from native signing commitment","target":"crates/oregon-primitives/src/execution_envelope.rs","expected_broken_behavior":"Injected broken behavior: authorization scope omitted from native signing commitment.","killing_test":"signing_bytes_bind_fee_payer_and_authorization_scopes","kill_classification":"semantic-test-failure"},{"id":"EE-007","name":"proof bytes incorrectly included in native signing commitment","target":"crates/oregon-primitives/src/execution_envelope.rs","expected_broken_behavior":"Injected broken behavior: proof bytes incorrectly included in native signing commitment.","killing_test":"proof_bytes_are_excluded_from_native_signing_hash_but_included_in_txid","kill_classification":"semantic-test-failure"},{"id":"EE-008","name":"proof bytes omitted from full Oregon txid","target":"crates/oregon-primitives/src/execution_envelope.rs","expected_broken_behavior":"Injected broken behavior: proof bytes omitted from full Oregon txid.","killing_test":"proof_bytes_are_excluded_from_native_signing_hash_but_included_in_txid","kill_classification":"semantic-test-failure"},{"id":"EE-009","name":"Ethereum source authorization accepts mutable Oregon height window","target":"crates/oregon-primitives/src/execution_envelope.rs","expected_broken_behavior":"Injected broken behavior: Ethereum source authorization accepts mutable Oregon height window.","killing_test":"ethereum_source_authorization_requires_neutral_height_window","kill_classification":"semantic-test-failure"}]},{"id":"CS","display_name":"Contract State","runner":"scripts/verify_contract_state_mutations.py","runner_sha256":"3750ff917765530ec84c31b21dbcd8e6994ba1cb021f6481a4dffe8c3c312cbc","command":["python3","scripts/verify_contract_state_mutations.py"],"expected_count":17,"mutations":[{"id":"CS-001","name":"state update skips verification of the old value blob","target":"crates/oregon-contract-state/src/transition.rs","expected_broken_behavior":"Injected broken behavior: state update skips verification of the old value blob.","killing_test":"same_value_put_rejects_missing_old_value_blob","kill_classification":"semantic-test-failure"},{"id":"CS-002","name":"proof verifier trusts another decode domain's canonicality","target":"crates/oregon-contract-state/src/proof.rs","expected_broken_behavior":"Injected broken behavior: proof verifier trusts another decode domain's canonicality.","killing_test":"verification_rejects_default_sibling_for_its_own_domain","kill_classification":"semantic-test-failure"},{"id":"CS-003","name":"internal branch hash omits depth","target":"crates/oregon-contract-state/src/hash.rs","expected_broken_behavior":"Injected broken behavior: internal branch hash omits depth.","killing_test":"literal_vectors_pin_path_value_empty_and_one_leaf_roots","kill_classification":"semantic-test-failure"},{"id":"CS-004","name":"present empty value becomes deletion","target":"crates/oregon-contract-state/src/transition.rs","expected_broken_behavior":"Injected broken behavior: present empty value becomes deletion.","killing_test":"present_empty_value_survives_transition_and_proof","kill_classification":"semantic-test-failure"},{"id":"CS-005","name":"proof decoder accepts redundant default sibling","target":"crates/oregon-contract-state/src/proof.rs","expected_broken_behavior":"Injected broken behavior: proof decoder accepts redundant default sibling.","killing_test":"proof_decoder_rejects_malformed_and_redundant_default_siblings","kill_classification":"semantic-test-failure"},{"id":"CS-006","name":"aggregate accepts unsorted and duplicate domain ids","target":"crates/oregon-primitives/src/state_commitment.rs","expected_broken_behavior":"Injected broken behavior: aggregate accepts unsorted and duplicate domain ids.","killing_test":"aggregate_rejects_empty_malformed_oversized_unsorted_and_duplicate_domains","kill_classification":"semantic-test-failure"},{"id":"CS-007","name":"proof verification substitutes WASM for supplied domain","target":"crates/oregon-contract-state/src/proof.rs","expected_broken_behavior":"Injected broken behavior: proof verification substitutes WASM for supplied domain.","killing_test":"proof_verification_binds_domain_key_value_and_root","kill_classification":"semantic-test-failure"},{"id":"CS-008","name":"path-key hash omits commitment domain","target":"crates/oregon-contract-state/src/hash.rs","expected_broken_behavior":"Injected broken behavior: path-key hash omits commitment domain.","killing_test":"identical_raw_key_and_value_are_domain_separated","kill_classification":"semantic-test-failure"},{"id":"CS-009","name":"path traversal becomes LSB-first","target":"crates/oregon-contract-state/src/hash.rs","expected_broken_behavior":"Injected broken behavior: path traversal becomes LSB-first.","killing_test":"path_bits_are_msb_first_at_frozen_boundaries","kill_classification":"semantic-test-failure"},{"id":"CS-010","name":"empty leaf uses zero instead of domain-separated hash","target":"crates/oregon-contract-state/src/hash.rs","expected_broken_behavior":"Injected broken behavior: empty leaf uses zero instead of domain-separated hash.","killing_test":"literal_vectors_pin_path_value_empty_and_one_leaf_roots","kill_classification":"semantic-test-failure"},{"id":"CS-011","name":"two-default-child subtree is not collapsed to canonical empty","target":"crates/oregon-contract-state/src/transition.rs","expected_broken_behavior":"Injected broken behavior: two-default-child subtree is not collapsed to canonical empty.","killing_test":"update_delete_and_read_preserve_immutable_snapshot_semantics","kill_classification":"semantic-test-failure"},{"id":"CS-012","name":"duplicate state paths are accepted","target":"crates/oregon-contract-state/src/transition.rs","expected_broken_behavior":"Injected broken behavior: duplicate state paths are accepted.","killing_test":"duplicate_path_and_domain_mismatch_fail_closed","kill_classification":"semantic-test-failure"},{"id":"CS-013","name":"aggregate descriptor omits domain id","target":"crates/oregon-primitives/src/state_commitment.rs","expected_broken_behavior":"Injected broken behavior: aggregate descriptor omits domain id.","killing_test":"aggregate_root_binds_domain_scheme_and_child_root","kill_classification":"semantic-test-failure"},{"id":"CS-014","name":"aggregate descriptor omits commitment scheme id","target":"crates/oregon-primitives/src